{
  "$schema": "https://json-schema.org/draft/2020-12/schema",
  "$id": "https://euconform.dev/schemas/ecef/aibom-v1.schema.json",
  "title": "EuConform Evidence Format AI BOM v1",
  "description": "Stage 1 inventory document for AI-relevant components and compliance capabilities.",
  "type": "object",
  "required": ["schemaVersion", "generatedAt", "project", "components", "complianceCapabilities"],
  "additionalProperties": false,
  "properties": {
    "schemaVersion": {
      "const": "euconform.aibom.v1"
    },
    "generatedAt": {
      "type": "string",
      "format": "date-time"
    },
    "project": {
      "type": "object",
      "required": ["name", "rootPath"],
      "additionalProperties": false,
      "properties": {
        "name": { "type": "string" },
        "rootPath": { "type": "string" }
      }
    },
    "components": {
      "type": "array",
      "items": {
        "type": "object",
        "required": ["id", "kind", "name", "source"],
        "additionalProperties": false,
        "properties": {
          "id": { "type": "string" },
          "kind": {
            "enum": [
              "framework",
              "runtime",
              "inference-provider",
              "ai-framework",
              "model",
              "vector-store",
              "embedding",
              "dataset",
              "tool"
            ]
          },
          "name": { "type": "string" },
          "version": { "type": "string" },
          "source": {
            "enum": ["package.json", "lock-file", "code", "config", "docs"]
          }
        }
      }
    },
    "complianceCapabilities": {
      "type": "object",
      "required": [
        "biasEvaluation",
        "jsonExport",
        "pdfExport",
        "loggingInfrastructure",
        "humanReviewFlow",
        "incidentHandling"
      ],
      "additionalProperties": false,
      "properties": {
        "biasEvaluation": { "type": "boolean" },
        "jsonExport": { "type": "boolean" },
        "pdfExport": { "type": "boolean" },
        "loggingInfrastructure": { "type": "boolean" },
        "humanReviewFlow": { "type": "boolean" },
        "incidentHandling": { "type": "boolean" }
      }
    }
  }
}
