{
  "schemaVersion": "euconform.aibom.v1",
  "generatedAt": "2026-04-10T12:10:00.000Z",
  "project": {
    "name": "example-rag-service",
    "rootPath": "/examples/rag"
  },
  "components": [
    { "id": "runtime:node-js", "kind": "runtime", "name": "Node.js", "source": "package.json" },
    {
      "id": "ai-framework:langchain",
      "kind": "ai-framework",
      "name": "LangChain",
      "source": "package.json"
    },
    { "id": "vector-store:chromadb", "kind": "vector-store", "name": "ChromaDB", "source": "code" },
    { "id": "embedding:embeddings", "kind": "embedding", "name": "Embeddings", "source": "code" },
    {
      "id": "inference-provider:ollama",
      "kind": "inference-provider",
      "name": "Ollama",
      "source": "config"
    }
  ],
  "complianceCapabilities": {
    "biasEvaluation": true,
    "jsonExport": true,
    "pdfExport": false,
    "loggingInfrastructure": true,
    "humanReviewFlow": true,
    "incidentHandling": true
  }
}
